{
  "quality_summary": "测试结果 overall=7.8 pass=False",
  "scores": {
    "fact_safety": 9,
    "doc_type_fit": 8,
    "mango_style_fit": 5,
    "logic_completeness": 8,
    "language_quality": 8,
    "risk_control": 9
  },
  "threshold": 8,
  "overall_score": 7.8,
  "failed_dimensions": [
    "mango_style_fit"
  ],
  "overall_pass": false,
  "rewrite_required": true,
  "quality_rewrite_instructions": [
    {
      "dimension": "mango_style_fit",
      "target": "≥8",
      "current_text": "第2段当前表达",
      "suggested_action": "replace",
      "suggested_text": "增加芒果系口语化表达",
      "reason": "风格偏离",
      "basis": "mango_style_fit=5"
    }
  ],
  "human_review_required": false,
  "risk_notes": [],
  "scoring_basis": {
    "fact_safety": "9分",
    "doc_type_fit": "8分",
    "mango_style_fit": "5分",
    "logic_completeness": "8分",
    "language_quality": "8分",
    "risk_control": "9分"
  },
  "no_new_facts_check": {
    "status": "pass",
    "suspected_new_facts": [],
    "detail": "无新增事实"
  },
  "doc_type_check": {
    "status": "pass",
    "detail": "文种匹配"
  },
  "style_check": {
    "status": "fail",
    "detail": "风格偏离"
  },
  "final_output_policy": {
    "recommendation": "rewrite",
    "reason": "存在低分维度"
  },
  "quality_gate_policy": {
    "no_body_generation": true,
    "no_body_modification": true,
    "no_new_facts": true,
    "no_rag_call": true,
    "no_doc_type_change": true,
    "evaluate_only": true
  }
}