{
  "quality_summary": "测试结果 overall=6.7 pass=False",
  "scores": {
    "fact_safety": 7,
    "doc_type_fit": 7,
    "mango_style_fit": 6,
    "logic_completeness": 7,
    "language_quality": 6,
    "risk_control": 7
  },
  "threshold": 8,
  "overall_score": 6.7,
  "failed_dimensions": [
    "fact_safety",
    "doc_type_fit",
    "mango_style_fit",
    "logic_completeness",
    "language_quality",
    "risk_control"
  ],
  "overall_pass": false,
  "rewrite_required": true,
  "quality_rewrite_instructions": [],
  "human_review_required": true,
  "risk_notes": [
    "多维度不达标，需人工复核"
  ],
  "scoring_basis": {
    "fact_safety": "7分",
    "doc_type_fit": "7分",
    "mango_style_fit": "6分",
    "logic_completeness": "7分",
    "language_quality": "6分",
    "risk_control": "7分"
  },
  "no_new_facts_check": {
    "status": "warning",
    "suspected_new_facts": [
      {"text": "测试新增事实", "location": "第3段", "reason": "extract中无此数据"}
    ],
    "detail": "extract中无此数据"
  },
  "doc_type_check": {
    "status": "pass",
    "detail": "文种匹配"
  },
  "style_check": {
    "status": "fail",
    "detail": "风格偏离"
  },
  "final_output_policy": {
    "recommendation": "warn_and_output",
    "reason": "达到最大返修轮次仍不达标"
  },
  "quality_gate_policy": {
    "no_body_generation": true,
    "no_body_modification": true,
    "no_new_facts": true,
    "no_rag_call": true,
    "no_doc_type_change": true,
    "evaluate_only": true
  }
}